{
  "apiVersion": "xgeny.io/v1alpha1",
  "kind": "PolicyDecision",
  "decisionId": "decision-ask-001",
  "requestId": "perm-critical-001",
  "decision": "ask",
  "policySources": [
    {
      "kind": "user_profile",
      "id": "full-local-critical-gate",
      "digest": "sha256:2222222222222222222222222222222222222222222222222222222222222222"
    }
  ],
  "interactionId": "interaction-001",
  "decidedAt": "2026-08-28T01:00:02Z"
}
